{
  "$schema": "https://json-schema.org/draft/2020-12/schema",
  "$id": "urn:areneon:schema:contracts:v1:belief-config",
  "title": "BeliefConfig",
  "description": "The reviewed configuration of the opponent belief filter (ADR-025 sections 3 and 5): reviewed data, never code. It names the abilities that can hide a Pokemon's identity and the bounds of the filter's two fail-closed searches. Integers only. Its RFC 8785 SHA-256 is belief_config_hash, a part of the belief identity. A later evidence switch is a minor change within v1; a change of any value is a new record, never an edit.",
  "type": "object",
  "additionalProperties": false,
  "required": [
    "schema_version",
    "identity_hiding_abilities",
    "max_legality_redraws",
    "max_disguise_assignments"
  ],
  "properties": {
    "schema_version": {
      "const": 1
    },
    "identity_hiding_abilities": {
      "description": "The abilities that let a Pokemon hide its identity (today illusion), sorted and unique; each is checked against the vocabulary and a species can hide when its vocabulary ability list holds one. No species name is written in code.",
      "type": "array",
      "maxItems": 16,
      "items": {
        "description": "An ability id of the team vocabulary.",
        "type": "string",
        "pattern": "^[a-z0-9]+$",
        "minLength": 1,
        "maxLength": 64
      }
    },
    "max_legality_redraws": {
      "description": "The most times a world with an illegal set is redrawn from the next counter block before the sampler refuses (legality_redraws_exhausted).",
      "type": "integer",
      "minimum": 0,
      "maximum": 1000000
    },
    "max_disguise_assignments": {
      "description": "The most disguise assignments the belief enumerates before it refuses (disguise_assignments_exceeded).",
      "type": "integer",
      "minimum": 1,
      "maximum": 1000000
    },
    "damage_evidence": {
      "description": "Optional (a minor change within v1; absent keeps every byte and hash of the config, and the belief then reads no damage). The reviewed rules of the damage evidence of slice 4 (ADR-025 section 7, finding N9): how many candidate sets are checked per event, how the engine's display rounds hit points to the shown percentage, which modifiers make a hit non-isolated (and so no evidence) and which candidate items and abilities the probe does not model. Every id is checked against the team vocabulary by the reader; no damage or modifier rule is written in code.",
      "type": "object",
      "additionalProperties": false,
      "required": [
        "max_checked",
        "shown_hp_rounding",
        "non_isolating",
        "unmodelled"
      ],
      "properties": {
        "max_checked": {
          "description": "The most candidate sets (ability, item and named spread) checked per forme and event, most likely first; the rest stay unchecked and constrain nothing.",
          "type": "integer",
          "minimum": 1,
          "maximum": 4096
        },
        "shown_hp_rounding": {
          "description": "How the pinned engine's display turns hit points into the shown percentage of an opponent's Pokemon (the forward direction; ADR-018's assumedHp rounding is the inverse, and a bridge test ties the two): a shown percentage above 0 is never 0 while hit points remain.",
          "enum": [
            "floor",
            "ceil",
            "nearest"
          ]
        },
        "non_isolating": {
          "description": "What makes a hit non-isolated (no evidence): a hit of one of these moves, or one of them used earlier in the same turn (Helping Hand); one of these moves used earlier in the channel by anyone, for a lasting effect on stats the reader does not show (Guard Split); one of these abilities held, or possibly held (a roster ability of an unrevealed Pokemon), by a Pokemon in play other than the attacker and the defender (Friend Guard); a move whose target type is one of these (spread reduction).",
          "type": "object",
          "additionalProperties": false,
          "required": [
            "abilities",
            "lasting_moves",
            "moves",
            "targets"
          ],
          "properties": {
            "abilities": {
              "description": "Ability ids of the team vocabulary, sorted and unique.",
              "type": "array",
              "maxItems": 64,
              "items": {
                "type": "string",
                "pattern": "^[a-z0-9]+$",
                "minLength": 1,
                "maxLength": 64
              }
            },
            "lasting_moves": {
              "description": "Move ids of the team vocabulary, sorted and unique.",
              "type": "array",
              "maxItems": 64,
              "items": {
                "type": "string",
                "pattern": "^[a-z0-9]+$",
                "minLength": 1,
                "maxLength": 64
              }
            },
            "moves": {
              "description": "Move ids of the team vocabulary, sorted and unique.",
              "type": "array",
              "maxItems": 64,
              "items": {
                "type": "string",
                "pattern": "^[a-z0-9]+$",
                "minLength": 1,
                "maxLength": 64
              }
            },
            "targets": {
              "description": "Engine move target types, sorted and unique.",
              "type": "array",
              "maxItems": 16,
              "items": {
                "type": "string",
                "pattern": "^[A-Za-z]+$",
                "minLength": 1,
                "maxLength": 32
              }
            }
          }
        },
        "unmodelled": {
          "description": "Candidate items and abilities whose damage effect depends on state the probe does not declare (turn order, a counter): a candidate that holds one is not checked, it constrains nothing.",
          "type": "object",
          "additionalProperties": false,
          "required": [
            "abilities",
            "items"
          ],
          "properties": {
            "abilities": {
              "description": "Ability ids of the team vocabulary, sorted and unique.",
              "type": "array",
              "maxItems": 64,
              "items": {
                "type": "string",
                "pattern": "^[a-z0-9]+$",
                "minLength": 1,
                "maxLength": 64
              }
            },
            "items": {
              "description": "Item ids of the team vocabulary, sorted and unique.",
              "type": "array",
              "maxItems": 64,
              "items": {
                "type": "string",
                "pattern": "^[a-z0-9]+$",
                "minLength": 1,
                "maxLength": 64
              }
            }
          }
        }
      }
    },
    "speed_evidence": {
      "description": "Optional (a minor change within v1; absent keeps every byte and hash of the config, and the belief then reads no speed order). The reviewed rules of the speed-order evidence of slice 4 part 2 (ADR-025 section 7): how many candidate sets are checked per forme and event, what makes a turn's order non-isolated (a speed-changing event before both actions that the reader's state does not show) and which candidate items and abilities the speed_order probe does not model. Every id is checked against the team vocabulary by the reader; no speed rule is written in code.",
      "type": "object",
      "additionalProperties": false,
      "required": [
        "max_checked",
        "non_isolating",
        "unmodelled"
      ],
      "properties": {
        "max_checked": {
          "description": "The most candidate sets (ability, item and named spread) checked per forme and event, most likely first; the rest stay unchecked and constrain nothing.",
          "type": "integer",
          "minimum": 1,
          "maximum": 4096
        },
        "non_isolating": {
          "description": "What makes the order of two same-priority actions non-isolated (no evidence): one of these moves used earlier in the same turn by anyone (After You, Quash); one of these moves used earlier in the channel by anyone, for a lasting change of Speed the reader does not show (Speed Swap); one of these abilities held, or possibly held, by a Pokemon in play other than the two acting ones (Cloud Nine and Air Lock change what weather does to Speed).",
          "type": "object",
          "additionalProperties": false,
          "required": [
            "abilities",
            "lasting_moves",
            "moves"
          ],
          "properties": {
            "abilities": {
              "description": "Ability ids of the team vocabulary, sorted and unique.",
              "type": "array",
              "maxItems": 64,
              "items": {
                "type": "string",
                "pattern": "^[a-z0-9]+$",
                "minLength": 1,
                "maxLength": 64
              }
            },
            "lasting_moves": {
              "description": "Move ids of the team vocabulary, sorted and unique.",
              "type": "array",
              "maxItems": 64,
              "items": {
                "type": "string",
                "pattern": "^[a-z0-9]+$",
                "minLength": 1,
                "maxLength": 64
              }
            },
            "moves": {
              "description": "Move ids of the team vocabulary, sorted and unique.",
              "type": "array",
              "maxItems": 64,
              "items": {
                "type": "string",
                "pattern": "^[a-z0-9]+$",
                "minLength": 1,
                "maxLength": 64
              }
            }
          }
        },
        "unmodelled": {
          "description": "Candidate items and abilities whose effect on turn order depends on state the speed_order probe does not declare (an item lost this game, a counter): a candidate that holds one is not checked, and a pair whose own Pokemon holds one is not evidence.",
          "type": "object",
          "additionalProperties": false,
          "required": [
            "abilities",
            "items"
          ],
          "properties": {
            "abilities": {
              "description": "Ability ids of the team vocabulary, sorted and unique.",
              "type": "array",
              "maxItems": 64,
              "items": {
                "type": "string",
                "pattern": "^[a-z0-9]+$",
                "minLength": 1,
                "maxLength": 64
              }
            },
            "items": {
              "description": "Item ids of the team vocabulary, sorted and unique.",
              "type": "array",
              "maxItems": 64,
              "items": {
                "type": "string",
                "pattern": "^[a-z0-9]+$",
                "minLength": 1,
                "maxLength": 64
              }
            }
          }
        }
      }
    }
  }
}
