{
  "schema_version": 1,
  "identity_hiding_abilities": [
    "snowwarning"
  ],
  "max_legality_redraws": 32,
  "max_disguise_assignments": 64,
  "speed_evidence": {
    "max_checked": 32,
    "non_isolating": {
      "abilities": [
        "snowwarning"
      ],
      "lasting_moves": [
        "aerialace"
      ],
      "moves": [
        "aerialace"
      ]
    },
    "unmodelled": {
      "abilities": [
        "snowwarning"
      ],
      "items": [
        "abomasite"
      ]
    }
  }
}
